{
  "$schema": "http://json-schema.org/draft-07/schema#",
  "title": "data/{code}/briefs.json — 每日简报",
  "type": "array",
  "items": {
    "type": "object",
    "required": ["date", "content"],
    "properties": {
      "id":      { "type": "string" },
      "date":    { "type": "string", "pattern": "^\\d{4}-\\d{2}-\\d{2}$" },
      "content": { "type": "string" },
      "price":   { "type": ["number", "null"] },
      "change_pct": { "type": ["number", "null"] },
      "amplitude":  { "type": ["number", "null"] },
      "has_value":  { "type": "boolean" },
      "created_at": { "type": "string" }
    }
  }
}
