[
  {
    "id": "601e7986",
    "date": "2026-07-20",
    "content": "小幅低开后震荡走低，收跌7.8%，振幅较大",
    "has_value": true,
    "price": 26.66,
    "change_pct": -7.75,
    "amplitude": 10.55,
    "created_at": "2026-07-20T00:20:21.429991+00:00"
  },
  {
    "id": "420e77d4",
    "date": "2026-07-22",
    "content": "小幅低开后震荡走低，收跌3.9%，振幅较大",
    "has_value": true,
    "price": 26.6,
    "change_pct": -3.9,
    "amplitude": 6.03,
    "created_at": "2026-07-22T07:30:01.710404+00:00"
  },
  {
    "id": "ea20ed05",
    "date": "2026-07-23",
    "content": "小幅高开后震荡走低，收跌2.8%，振幅较大",
    "has_value": true,
    "price": 25.86,
    "change_pct": -2.78,
    "amplitude": 6.32,
    "created_at": "2026-07-23T07:30:02.069496+00:00"
  },
  {
    "id": "82ade6b9",
    "date": "2026-08-03",
    "content": "低开探底回升，收跌1.5%，振幅较大",
    "has_value": true,
    "price": 23.12,
    "change_pct": -1.53,
    "amplitude": 6.18,
    "created_at": "2026-08-03T07:30:01.918467+00:00"
  },
  {
    "id": "3c608193",
    "date": "2026-08-04",
    "content": "小幅高开后震荡走高，收涨3.0%",
    "has_value": true,
    "price": 23.82,
    "change_pct": 3.03,
    "amplitude": 4.67,
    "created_at": "2026-08-04T07:30:01.910310+00:00"
  },
  {
    "id": "987ac482",
    "date": "2026-08-05",
    "content": "小幅低开后震荡走高，收涨7.0%，振幅较大",
    "has_value": true,
    "price": 25.5,
    "change_pct": 7.05,
    "amplitude": 9.19,
    "created_at": "2026-08-05T07:30:02.013875+00:00"
  },
  {
    "id": "fce59dfb",
    "date": "2026-08-06",
    "content": "低开后震荡走高，微涨1.5%，振幅较大",
    "has_value": true,
    "price": 25.88,
    "change_pct": 1.49,
    "amplitude": 6.39,
    "created_at": "2026-08-06T07:30:01.624582+00:00"
  },
  {
    "id": "effd62a9",
    "date": "2026-08-07",
    "content": "小幅低开后震荡走高，收涨3.0%，振幅较大",
    "has_value": true,
    "price": 26.65,
    "change_pct": 2.98,
    "amplitude": 6.49,
    "created_at": "2026-08-07T07:30:01.895590+00:00"
  },
  {
    "id": "0d5f8892",
    "date": "2026-08-10",
    "content": "小幅低开后震荡走低，收跌2.9%，振幅较大",
    "has_value": true,
    "price": 25.87,
    "change_pct": -2.93,
    "amplitude": 5.44,
    "created_at": "2026-08-10T07:30:01.706712+00:00"
  },
  {
    "id": "c3893f9d",
    "date": "2026-08-11",
    "content": "小幅低开后震荡走低，微跌1.1%",
    "has_value": true,
    "price": 25.58,
    "change_pct": -1.12,
    "amplitude": 4.14,
    "created_at": "2026-08-11T07:30:01.298972+00:00"
  }
]