[
  {
    "id": "f843ade9",
    "date": "2026-07-28",
    "content": "小幅低开后震荡走高，微涨1.5%",
    "has_value": true,
    "price": 85.37,
    "change_pct": 1.47,
    "amplitude": 2.27,
    "created_at": "2026-07-28T07:30:01.984861+00:00"
  },
  {
    "id": "1136fb30",
    "date": "2026-07-29",
    "content": "小幅低开后震荡走高，收涨1.9%",
    "has_value": true,
    "price": 87.01,
    "change_pct": 1.92,
    "amplitude": 2.81,
    "created_at": "2026-07-29T07:30:01.619296+00:00"
  },
  {
    "id": "0fce2f80",
    "date": "2026-07-30",
    "content": "平开后震荡走高，收涨2.2%",
    "has_value": true,
    "price": 88.95,
    "change_pct": 2.23,
    "amplitude": 3.45,
    "created_at": "2026-07-30T07:30:01.293652+00:00"
  },
  {
    "id": "930d7d33",
    "date": "2026-07-31",
    "content": "低开探底回升，收跌1.5%",
    "has_value": true,
    "price": 87.6,
    "change_pct": -1.52,
    "amplitude": 3.69,
    "created_at": "2026-07-31T07:30:01.408697+00:00"
  },
  {
    "id": "d2a8e96f",
    "date": "2026-08-03",
    "content": "小幅低开后震荡走低，收跌1.9%",
    "has_value": true,
    "price": 85.9,
    "change_pct": -1.94,
    "amplitude": 2.65,
    "created_at": "2026-08-03T07:30:01.917103+00:00"
  },
  {
    "id": "e4c17295",
    "date": "2026-08-07",
    "content": "小幅低开后震荡走低，收跌2.1%",
    "has_value": true,
    "price": 83.5,
    "change_pct": -2.13,
    "amplitude": 2.77,
    "created_at": "2026-08-07T07:30:01.893406+00:00"
  },
  {
    "id": "b4cc6ecc",
    "date": "2026-08-10",
    "content": "平开后震荡走高，收涨2.2%",
    "has_value": true,
    "price": 85.3,
    "change_pct": 2.16,
    "amplitude": 3.53,
    "created_at": "2026-08-10T07:30:01.704218+00:00"
  }
]