[
  {
    "id": "633d44c4",
    "date": "2026-07-22",
    "content": "小幅低开后震荡走低，收跌1.7%",
    "has_value": true,
    "price": 8.51,
    "change_pct": -1.73,
    "amplitude": 2.42,
    "created_at": "2026-07-22T07:30:01.708531+00:00"
  },
  {
    "id": "930bac97",
    "date": "2026-07-23",
    "content": "小幅低开后震荡走高，微涨1.3%",
    "has_value": true,
    "price": 8.62,
    "change_pct": 1.29,
    "amplitude": 2.23,
    "created_at": "2026-07-23T07:30:02.066200+00:00"
  },
  {
    "id": "9286b134",
    "date": "2026-08-06",
    "content": "小幅低开后震荡走低，微跌1.0%",
    "has_value": true,
    "price": 8.7,
    "change_pct": -1.02,
    "amplitude": 1.59,
    "created_at": "2026-08-06T07:30:01.617614+00:00"
  }
]