[
  {
    "id": "50a16c99",
    "date": "2026-07-22",
    "content": "小幅低开后震荡走高，微涨0.0%",
    "has_value": true,
    "price": 152.27,
    "change_pct": 0.01,
    "amplitude": 2.31,
    "created_at": "2026-07-22T07:30:01.692252+00:00"
  },
  {
    "id": "855092fe",
    "date": "2026-08-03",
    "content": "小幅高开后震荡走低，微跌1.2%",
    "has_value": true,
    "price": 156.89,
    "change_pct": -1.25,
    "amplitude": 1.79,
    "created_at": "2026-08-03T07:30:01.901641+00:00"
  },
  {
    "id": "1d936fa1",
    "date": "2026-08-04",
    "content": "小幅低开后震荡走低，收跌1.7%",
    "has_value": true,
    "price": 154.27,
    "change_pct": -1.67,
    "amplitude": 2.28,
    "created_at": "2026-08-04T07:30:01.899384+00:00"
  },
  {
    "id": "7fb65294",
    "date": "2026-08-06",
    "content": "小幅高开后震荡走低，收跌3.0%",
    "has_value": true,
    "price": 149.75,
    "change_pct": -2.95,
    "amplitude": 3.48,
    "created_at": "2026-08-06T07:30:01.604690+00:00"
  },
  {
    "id": "54a100ad",
    "date": "2026-08-07",
    "content": "小幅低开后震荡走高，微涨1.1%",
    "has_value": true,
    "price": 151.41,
    "change_pct": 1.11,
    "amplitude": 2.03,
    "created_at": "2026-08-07T07:30:01.878283+00:00"
  },
  {
    "id": "220b9dc4",
    "date": "2026-08-10",
    "content": "小幅高开后震荡走高，收涨2.8%",
    "has_value": true,
    "price": 155.58,
    "change_pct": 2.75,
    "amplitude": 3.74,
    "created_at": "2026-08-10T07:30:01.685893+00:00"
  },
  {
    "id": "ea27b243",
    "date": "2026-08-11",
    "content": "小幅低开后震荡走低，微跌1.3%",
    "has_value": true,
    "price": 153.49,
    "change_pct": -1.34,
    "amplitude": 1.72,
    "created_at": "2026-08-11T07:30:01.289527+00:00"
  }
]