[
  {
    "id": "1e3c8755",
    "date": "2026-07-20",
    "content": "平开后单边下行，收跌7.6%",
    "has_value": true,
    "price": 98.74,
    "change_pct": -7.6,
    "amplitude": null,
    "created_at": "2026-07-20T00:14:08.775839+00:00"
  },
  {
    "id": "045402df",
    "date": "2026-07-22",
    "content": "小幅高开后震荡走低，收跌4.2%，振幅较大",
    "has_value": true,
    "price": 102.98,
    "change_pct": -4.24,
    "amplitude": 9.19,
    "created_at": "2026-07-22T07:30:01.690223+00:00"
  },
  {
    "id": "a4213adc",
    "date": "2026-07-23",
    "content": "高开冲高回落，收涨2.5%，振幅较大",
    "has_value": true,
    "price": 105.55,
    "change_pct": 2.5,
    "amplitude": 7.36,
    "created_at": "2026-07-23T07:30:02.044124+00:00"
  },
  {
    "id": "ec3704e8",
    "date": "2026-08-03",
    "content": "小幅高开后震荡走高，收涨2.1%，振幅较大",
    "has_value": true,
    "price": 114.0,
    "change_pct": 2.08,
    "amplitude": 5.46,
    "created_at": "2026-08-03T07:30:01.898291+00:00"
  },
  {
    "id": "7447fc98",
    "date": "2026-08-04",
    "content": "低开后震荡走高，收涨6.1%，振幅较大",
    "has_value": true,
    "price": 120.98,
    "change_pct": 6.12,
    "amplitude": 13.15,
    "created_at": "2026-08-04T07:30:01.895798+00:00"
  },
  {
    "id": "b6bde866",
    "date": "2026-08-05",
    "content": "低开后震荡走高，收涨6.0%，振幅较大",
    "has_value": true,
    "price": 128.19,
    "change_pct": 5.96,
    "amplitude": 13.66,
    "created_at": "2026-08-05T07:30:01.993497+00:00"
  },
  {
    "id": "c40005d4",
    "date": "2026-08-06",
    "content": "低开探底回升，微跌0.9%，振幅较大",
    "has_value": true,
    "price": 127.0,
    "change_pct": -0.93,
    "amplitude": 6.9,
    "created_at": "2026-08-06T07:30:01.601834+00:00"
  },
  {
    "id": "2c284ff0",
    "date": "2026-08-07",
    "content": "低开后震荡走高，微涨0.3%，振幅较大",
    "has_value": true,
    "price": 127.39,
    "change_pct": 0.31,
    "amplitude": 9.98,
    "created_at": "2026-08-07T07:30:01.863324+00:00"
  },
  {
    "id": "05262d80",
    "date": "2026-08-10",
    "content": "小幅低开探底回升，微跌0.4%，振幅较大",
    "has_value": true,
    "price": 126.9,
    "change_pct": -0.38,
    "amplitude": 7.83,
    "created_at": "2026-08-10T07:30:01.678019+00:00"
  },
  {
    "id": "d1e4e108",
    "date": "2026-08-11",
    "content": "低开后震荡走高，收涨2.5%，振幅较大",
    "has_value": true,
    "price": 130.05,
    "change_pct": 2.48,
    "amplitude": 11.64,
    "created_at": "2026-08-11T07:30:01.286883+00:00"
  }
]