[
  {
    "id": "64e58b24",
    "date": "2026-07-22",
    "content": "小幅低开后震荡走高，微涨0.6%",
    "has_value": true,
    "price": 4.83,
    "change_pct": 0.63,
    "amplitude": 2.29,
    "created_at": "2026-07-22T07:30:01.705375+00:00"
  },
  {
    "id": "5797de0f",
    "date": "2026-07-23",
    "content": "平开后震荡走高，微涨1.2%",
    "has_value": true,
    "price": 4.89,
    "change_pct": 1.24,
    "amplitude": 2.07,
    "created_at": "2026-07-23T07:30:02.055983+00:00"
  },
  {
    "id": "a60445a2",
    "date": "2026-08-04",
    "content": "小幅高开后震荡走低，收跌2.2%",
    "has_value": true,
    "price": 4.89,
    "change_pct": -2.2,
    "amplitude": 2.8,
    "created_at": "2026-08-04T07:30:01.903657+00:00"
  },
  {
    "id": "99eeb44e",
    "date": "2026-08-05",
    "content": "小幅低开后震荡走低，收跌1.6%",
    "has_value": true,
    "price": 4.81,
    "change_pct": -1.64,
    "amplitude": 2.04,
    "created_at": "2026-08-05T07:30:02.001872+00:00"
  },
  {
    "id": "966b626e",
    "date": "2026-08-06",
    "content": "平开后震荡走高，微涨0.6%",
    "has_value": true,
    "price": 4.84,
    "change_pct": 0.62,
    "amplitude": 2.08,
    "created_at": "2026-08-06T07:30:01.610486+00:00"
  }
]